vāseṭṭha 1	n		masc							name of a Brahman family											AN 8.44	vāseṭṭhasuttaṃ	ekaṃ samayaṃ bhagavā vesāliyaṃ viharati mahāvane kūṭāgārasālāyaṃ. atha kho <b>vāseṭṭho</b> upāsako yena bhagavā tenupasaṅkami;																	vāseṭṭh	a masc	13	2	300		"Spot a mistake? <a class=""link"" href=""https://docs.google.com/forms/d/e/1FAIpQLSc0KxEDyN5G2Mqr4t3AvDpXxSOIbIBi0GrZsAGhDB207sjLow/viewform?usp=pp_url&entry.438735500=vāseṭṭha 1&entry.644913945=Anki Deck Vocab Beginner Pāli Course"">Fix it here</a>."
vāda 6	ps		masc		vadati					doctrine; concept; thesis			√vad 1 a (to speak, say)		√vad + *a	vāda	√vad				SN 22.3	hāliddikānisuttaṃ	pacchā vacanīyaṃ pure avaca. sahitaṃ me, asahitaṃ te. adhiciṇṇaṃ te viparāvattaṃ. āropito te <b>vādo</b>				SN 12.2	vibhaṅgasuttaṃ	kām’upādānaṃ, diṭṭh’upādānaṃ, sīlabbat’upādānaṃ, atta-<b>vād’</b>upādānaṃ. idaṃ vuccati taṇhā-paccayā upādānaṃ.	Paṭicca-samuppāda	Dependent Origination	Teachings							23n	vād	a masc	13	2	214	[sound:vāda.mp3]	"Spot a mistake? <a class=""link"" href=""https://docs.google.com/forms/d/e/1FAIpQLSc0KxEDyN5G2Mqr4t3AvDpXxSOIbIBi0GrZsAGhDB207sjLow/viewform?usp=pp_url&entry.438735500=vāda 6&entry.644913945=Anki Deck Vocab Beginner Pāli Course"">Fix it here</a>."
vāda 5	n		masc		vadati					declaration; statement; assertion; claim			√vad 1 a (to say, speak)		√vad > vād + *a	vāda	√vad				SNP 50	cūḷabyūhasuttaṃ<br/>aṭṭhakavaggo 12	evam'pi viggayha vivādayanti, bālo paro akusalo'ti c'āhu,<br/>sacco nu <b>vādo</b> katamo imesaṃ, sabb'eva h'īme kusalā vadānā.																	vād	a masc	13	2	214	[sound:vāda.mp3]	"Spot a mistake? <a class=""link"" href=""https://docs.google.com/forms/d/e/1FAIpQLSc0KxEDyN5G2Mqr4t3AvDpXxSOIbIBi0GrZsAGhDB207sjLow/viewform?usp=pp_url&entry.438735500=vāda 5&entry.644913945=Anki Deck Vocab Beginner Pāli Course"">Fix it here</a>."
vāda 3	ps		masc		vadati					debate; argument; disputation			√vad 1 a (to speak, say)		√vad + *a	vāda	√vad				SNP 41	duṭṭhaṭṭhakasuttaṃ<br/>aṭṭhakavaggo 3	vadanti ve duṭṭhamanā'pi eke, atho'pi ve saccamanā vadanti,<br/><b>vādañ</b>'ca jātaṃ muni no upeti, tasmā munī n'atthi khilo kuhiñci.				Trad		saccaṃ vihāya mati-saccaka-vāda-ketuṃ, <b>vād’</b>ābhiropita-manaṃ ati-andha-bhūtaṃ, paññā-padīpa-jalito jitavā mun’indo	Jaya-maṅgala-aṭṭha-gāthā		Protective Recitations							60n	vād	a masc	13	2	214	[sound:vāda.mp3]	"Spot a mistake? <a class=""link"" href=""https://docs.google.com/forms/d/e/1FAIpQLSc0KxEDyN5G2Mqr4t3AvDpXxSOIbIBi0GrZsAGhDB207sjLow/viewform?usp=pp_url&entry.438735500=vāda 3&entry.644913945=Anki Deck Vocab Beginner Pāli Course"">Fix it here</a>."
vāda 2	nn		masc		vadati					speech; statement; assertion; what is said			√vad 1 a (to say, speak)		√vad > vād + *a	vāda	√vad				SNP 48	purābhedasuttaṃ<br/>aṭṭhakavaggo 10	yena naṃ vajjuṃ puthujjanā, atho samaṇabrāhmaṇā,<br/>taṃ tassa apurakkhataṃ, tasmā <b>vādesu</b> n'ejati.				SNP 51	mahābyūhasuttaṃ<br/>aṭṭhakavaggo 13	yam'āhu dhammaṃ paraman'ti eke, tam'eva hīnan'ti pan'āhu aññe,<br/>sacco nu <b>vādo</b> katamo imesaṃ, sabb'eva h'īme kusalā vadānā.											vād	a masc	13	2	214	[sound:vāda.mp3]	"Spot a mistake? <a class=""link"" href=""https://docs.google.com/forms/d/e/1FAIpQLSc0KxEDyN5G2Mqr4t3AvDpXxSOIbIBi0GrZsAGhDB207sjLow/viewform?usp=pp_url&entry.438735500=vāda 2&entry.644913945=Anki Deck Vocab Beginner Pāli Course"">Fix it here</a>."
vāta 2	p		masc	pp	vāti					atmosphere; air; vibe			√vā 1 a (to blow, emit odour)		√vā + ta	vāta	√vā				AN 7.61	pacalāyamānasuttaṃ	yāni ca kho tāni sen'āsanāni appasaddāni appanigghosāni vijana-<b>vātāni</b> manussarāhaseyyakāni paṭisallānasāruppāni tathārūpehi sen'āsanehi saṃsaggaṃ vaṇṇayāmī'ti																	vāt	a masc	13	2	192	[sound:vāta.mp3]	"Spot a mistake? <a class=""link"" href=""https://docs.google.com/forms/d/e/1FAIpQLSc0KxEDyN5G2Mqr4t3AvDpXxSOIbIBi0GrZsAGhDB207sjLow/viewform?usp=pp_url&entry.438735500=vāta 2&entry.644913945=Anki Deck Vocab Beginner Pāli Course"">Fix it here</a>."
vassa 1	p		masc		vassati					rain; downpour			√vass 1 a (to rain)		√vass + a	varṣa	√vṛṣ				DHP 186	buddhavaggo	na kahāpaṇa-<b>vassena</b>,<br/>titti kāmesu vijjati,<br/>app'assādā dukhā kāmā,<br/>iti viññāya paṇḍito																	vass	a masc	13	2	178	[sound:vassa.mp3]	"Spot a mistake? <a class=""link"" href=""https://docs.google.com/forms/d/e/1FAIpQLSc0KxEDyN5G2Mqr4t3AvDpXxSOIbIBi0GrZsAGhDB207sjLow/viewform?usp=pp_url&entry.438735500=vassa 1&entry.644913945=Anki Deck Vocab Beginner Pāli Course"">Fix it here</a>."
vasa 1	p		masc							wish; desire; will			√vas 1 a (to want, control)		√vas + a	vaśa	√vaś				MN 31	cūḷagosiṅgasuttaṃ	tassa mayhaṃ, bhante, evaṃ hoti, yaṃnūn'āhaṃ sakaṃ cittaṃ nikkhipitvā imesaṃ'y'eva āyasmantānaṃ cittassa <b>vasena</b>																	vas	a masc	13	2	292	[sound:vasa.mp3]	"Spot a mistake? <a class=""link"" href=""https://docs.google.com/forms/d/e/1FAIpQLSc0KxEDyN5G2Mqr4t3AvDpXxSOIbIBi0GrZsAGhDB207sjLow/viewform?usp=pp_url&entry.438735500=vasa 1&entry.644913945=Anki Deck Vocab Beginner Pāli Course"">Fix it here</a>."
vadha 2	pp		masc		vadheti					beating; punishment			√vadh 8 *e (to hurt, slaughter)		√vadh + a	vadha	√vadh				MN 19	dvedhāvitakkasuttaṃ	taṃ kissa hetu? passati hi so, bhikkhave, gopālako tatonidānaṃ <b>vadhaṃ</b> vā bandhanaṃ vā jāniṃ vā garahaṃ vā.				SN 42.11	bhadrakasuttaṃ	“yesaṃ me manussānaṃ <b>vadhena</b> vā bandhena vā jāniyā vā garahāya vā uppajjeyyuṃ sokaparideva-dukkhadomanass’upāyāsā, atthi me tesu chandarāgo.											vadh	a masc	13	2	96		"Spot a mistake? <a class=""link"" href=""https://docs.google.com/forms/d/e/1FAIpQLSc0KxEDyN5G2Mqr4t3AvDpXxSOIbIBi0GrZsAGhDB207sjLow/viewform?usp=pp_url&entry.438735500=vadha 2&entry.644913945=Anki Deck Vocab Beginner Pāli Course"">Fix it here</a>."
vadha 1	s		masc		vadheti					killing; slaughtering			√vadh 8 *e (to hurt, slaughter)		√vadh + a	vadha	√vadh										MN 51	kandarakasuttaṃ	ukkoṭana-vañcana-nikati-sāciyogā paṭivirato hoti, chedana-<b>vadha</b>-bandhana-viparāmosa-ālopa-sahasākārā paṭivirato hoti	Anupubba-sikkhā	The Gradual Training	Teachings							18n	vadh	a masc	13	2	96	[sound:coming-soon.mp3]	"Spot a mistake? <a class=""link"" href=""https://docs.google.com/forms/d/e/1FAIpQLSc0KxEDyN5G2Mqr4t3AvDpXxSOIbIBi0GrZsAGhDB207sjLow/viewform?usp=pp_url&entry.438735500=vadha 1&entry.644913945=Anki Deck Vocab Beginner Pāli Course"">Fix it here</a>."
vaṇṇa 10	pp		masc		vaṇṇeti					praise; approval; value			√vaṇṇ 8 *e (to praise)		√vaṇṇ + a	varṇa	√varṇ				VIN PAT SA 4	attakāmapāricariya sikkhāpada	yo pana bhikkhu, otiṇṇo vipariṇatena cittena, mātugāmassa santike attakāma-pāricariyāya <b>vaṇṇaṃ</b> bhāseyya: 				AN 4.100	potaliyasuttaṃ	idha, potaliya, ekacco puggalo avaṇṇ'ārahassa avaṇṇaṃ bhāsitā hoti bhūtaṃ tacchaṃ kālena, no ca kho vaṇṇ'ārahassa <b>vaṇṇaṃ</b> bhāsitā hoti bhūtaṃ tacchaṃ kālena.											vaṇṇ	a masc	13	2	812		"Spot a mistake? <a class=""link"" href=""https://docs.google.com/forms/d/e/1FAIpQLSc0KxEDyN5G2Mqr4t3AvDpXxSOIbIBi0GrZsAGhDB207sjLow/viewform?usp=pp_url&entry.438735500=vaṇṇa 10&entry.644913945=Anki Deck Vocab Beginner Pāli Course"">Fix it here</a>."
vaṇṇa 05	p		masc	pp						caste; social class			√var 1 a (to cover, dress, restrain)		√var + na	varṇa	√vṛ				APA 3	sāriputtattherāpadānaṃ	tath’ev’ime catu-<b>bbaṇṇā</b>, pabbajitvā tav’antike. jahanti purimaṃ nāmaṃ, buddhaputtā’ti ñāyare.																	vaṇṇ	a masc	13	2	812		"Spot a mistake? <a class=""link"" href=""https://docs.google.com/forms/d/e/1FAIpQLSc0KxEDyN5G2Mqr4t3AvDpXxSOIbIBi0GrZsAGhDB207sjLow/viewform?usp=pp_url&entry.438735500=vaṇṇa 05&entry.644913945=Anki Deck Vocab Beginner Pāli Course"">Fix it here</a>."
vaṇṇa 03	pp		masc							appearance; complexion; lit. cover			√var 1 a (to cover, dress, restrain)		√var + na	varṇa	√vṛ				AN 11.15	mettāsuttaṃ	tuvaṭaṃ cittaṃ samādhiyati, mukha-<b>vaṇṇo</b> vippasīdati, asammūḷho kālaṃ karoti				SN 1.10	araññasuttaṃ	araññe viharantānaṃ,<br/>santānaṃ brahmacārinaṃ,<br/>ekabhattaṃ bhuñjamānānaṃ,<br/>kena <b>vaṇṇo</b> pasīdatī'ti.											vaṇṇ	a masc	13	2	812		"Spot a mistake? <a class=""link"" href=""https://docs.google.com/forms/d/e/1FAIpQLSc0KxEDyN5G2Mqr4t3AvDpXxSOIbIBi0GrZsAGhDB207sjLow/viewform?usp=pp_url&entry.438735500=vaṇṇa 03&entry.644913945=Anki Deck Vocab Beginner Pāli Course"">Fix it here</a>."
vaṇṇa 02	p		masc							colour			√var 1 a (to cover, dress, restrain)		√var + na	varṇa	√vṛ				MN 10.8	mahāsatipaṭṭhānasuttaṃ	puna caparaṃ bhikkhu seyyathā’pi passeyya sarīraṃ sivathikāya chaḍḍitaṃ aṭṭhikāni setāni saṅkha-<b>vaṇṇa</b>-paṭibhāgāni																	vaṇṇ	a masc	13	2	812		"Spot a mistake? <a class=""link"" href=""https://docs.google.com/forms/d/e/1FAIpQLSc0KxEDyN5G2Mqr4t3AvDpXxSOIbIBi0GrZsAGhDB207sjLow/viewform?usp=pp_url&entry.438735500=vaṇṇa 02&entry.644913945=Anki Deck Vocab Beginner Pāli Course"">Fix it here</a>."
vaṇṇa 01	ps		masc							beauty; good looks			√var 1 a (to cover, dress, restrain)		√var + na	varṇa	√vṛ				DHP 109	sahassavaggo	abhivādana-sīlissa, niccaṃ vuḍḍh’āpacāyino, <br/>cattāro dhammā vaḍḍhanti, āyu <b>vaṇṇo</b> sukhaṃ balaṃ.				SNP 16	maṅgalasuttaṃ<br/>cūḷavaggo 4	atha kho aññatarā devatā abhikkantāya rattiyā abhikkanta-<b>vaṇṇā</b> kevalakappaṃ jetavanaṃ obhāsetvā yena bhagavā ten’upasaṅkami	Maṅgala-sutta	The Highest Blessings	Protective Recitations							51n	vaṇṇ	a masc	13	2	812	[sound:coming-soon.mp3]	"Spot a mistake? <a class=""link"" href=""https://docs.google.com/forms/d/e/1FAIpQLSc0KxEDyN5G2Mqr4t3AvDpXxSOIbIBi0GrZsAGhDB207sjLow/viewform?usp=pp_url&entry.438735500=vaṇṇa 01&entry.644913945=Anki Deck Vocab Beginner Pāli Course"">Fix it here</a>."
soṇa 3	p		masc							dog						śvāna					AN 2.9	cariyasuttaṃ	ime kho hirī ca ottappañca lokaṃ na pāleyyuṃ, sambhedaṃ loko agamissa, yathā aj’eḷakā kukkuṭa-sūkarā <b>soṇa</b>-siṅgālā.																	soṇ	a masc	13	2	100		"Spot a mistake? <a class=""link"" href=""https://docs.google.com/forms/d/e/1FAIpQLSc0KxEDyN5G2Mqr4t3AvDpXxSOIbIBi0GrZsAGhDB207sjLow/viewform?usp=pp_url&entry.438735500=soṇa 3&entry.644913945=Anki Deck Vocab Beginner Pāli Course"">Fix it here</a>."
soṇa 1	p		masc							personal name of a monk; lit. dog						śvāna					AN 6.55	soṇasuttaṃ	tena kho pana samayena āyasmā soṇo rājagahe viharati sītavanasmiṃ. atha kho āyasmato <b>soṇassa</b> rahogatassa paṭisallīnassa evaṃ cetaso parivitakko udapādi																	soṇ	a masc	13	2	100		"Spot a mistake? <a class=""link"" href=""https://docs.google.com/forms/d/e/1FAIpQLSc0KxEDyN5G2Mqr4t3AvDpXxSOIbIBi0GrZsAGhDB207sjLow/viewform?usp=pp_url&entry.438735500=soṇa 1&entry.644913945=Anki Deck Vocab Beginner Pāli Course"">Fix it here</a>."
sela 2	pp		masc		silā					rock; stone					silā + *a	śilā					DHP 081	paṇḍitavaggo	<b>selo</b> yathā ekaghano, vātena na samīrati, <br/>evaṃ nindāpasaṃsāsu, na samiñjanti paṇḍitā.				AN 6.55	soṇasuttaṃ	seyyathā’pi, bhante, <b>selo</b> pabbato acchiddo asusiro ekagghano. atha puratthimāya ce'pi disāya āgaccheyya bhusā vātavuṭṭhi n'eva naṃ saṅkampeyya na sampakampeyya na sampavedheyya											sel	a masc	13	2	118		"Spot a mistake? <a class=""link"" href=""https://docs.google.com/forms/d/e/1FAIpQLSc0KxEDyN5G2Mqr4t3AvDpXxSOIbIBi0GrZsAGhDB207sjLow/viewform?usp=pp_url&entry.438735500=sela 2&entry.644913945=Anki Deck Vocab Beginner Pāli Course"">Fix it here</a>."
sūriya	pp		masc		sūra					the Sun; lit. shining			√sur 1 a (to shine, be supreme)		√sur > sūr + *a + iya<br/>sūra + iya	sūrya	√sur	suriya			SN 20.6	dhanuggahasuttaṃ	yathā ca, bhikkhave, tassa purisassa javo yathā ca candima-<b>sūriyānaṃ</b> javo yathā ca yā devatā candimasūriyānaṃ purato dhāvanti tāsaṃ devatānaṃ javo				SN 48.42	uṇṇābhabrāhmaṇasuttaṃ	seyyathā'pi, bhikkhave, kūṭ'āgāre vā kūṭ'āgārasālāyaṃ vā pācīnavātapānā <b>sūriye</b> uggacchante vātapānena rasmi pavisitvā kv'āssa patiṭṭhitā'ti?											sūriy	a masc	13	2	88		"Spot a mistake? <a class=""link"" href=""https://docs.google.com/forms/d/e/1FAIpQLSc0KxEDyN5G2Mqr4t3AvDpXxSOIbIBi0GrZsAGhDB207sjLow/viewform?usp=pp_url&entry.438735500=sūriya&entry.644913945=Anki Deck Vocab Beginner Pāli Course"">Fix it here</a>."
sudda 1	nn		masc							man of the lowest caste; worker; peasant						śūdra					UD 45	uposathasuttaṃ	evam'eva kho, bhikkhave, cattāro vaṇṇā, khattiyā, brāhmaṇā, vessā, <b>suddā</b> te tathāgatappavedite dhammavinaye agārasmā anagāriyaṃ pabbajitvā jahanti purimāni nāmagottāni, samaṇā sakyaputtiyā tv'eva saṅkhaṃ gacchanti				VIN 1.2.4	attakāmapāricariyasikkhāpadaṃ	mādisan'ti khattiyaṃ vā brāhmaṇaṃ vā vessaṃ vā <b>suddaṃ</b> vā.											sudd	a masc	13	2	109		"Spot a mistake? <a class=""link"" href=""https://docs.google.com/forms/d/e/1FAIpQLSc0KxEDyN5G2Mqr4t3AvDpXxSOIbIBi0GrZsAGhDB207sjLow/viewform?usp=pp_url&entry.438735500=sudda 1&entry.644913945=Anki Deck Vocab Beginner Pāli Course"">Fix it here</a>."
sāra 3	pp		masc		sarati					hardwood; heartwood			√sar 1 a (to go, flow)		√sar + *a	sāra	√sṛ				SN 22.95	pheṇapiṇḍūpamasuttaṃ	seyyathā’pi, bhikkhave, puriso <b>sār’</b>atthiko <b>sāra</b>-gavesī <b>sāra</b>-pariyesanaṃ caramāno tiṇhaṃ kuṭhāriṃ ādāya vanaṃ paviseyya.				SN 22.95	pheṇapiṇḍūpamasuttaṃ	so tassa pattavaṭṭiṃ vinibbhujanto pheggum’pi n’ādhigaccheyya, kuto <b>sāraṃ</b>!											sār	a masc	13	2	131	[sound:sāra.mp3]	"Spot a mistake? <a class=""link"" href=""https://docs.google.com/forms/d/e/1FAIpQLSc0KxEDyN5G2Mqr4t3AvDpXxSOIbIBi0GrZsAGhDB207sjLow/viewform?usp=pp_url&entry.438735500=sāra 3&entry.644913945=Anki Deck Vocab Beginner Pāli Course"">Fix it here</a>."
sāmika 2	p		masc		sāmī					husband					sāmī + ka	svāmika, svāmin					AN 4.73	sappurisasuttaṃ	’seyyathā’pi vadhukā yaññad'eva rattiṃ vā divaṃ vā ānītā hoti, tāva’d’ev’assā tibbaṃ hir’ottappaṃ paccupaṭṭhitaṃ hoti sassuyā’pi sasure’pi <b>sāmike’</b>pi antamaso dāsa-kammakara-porisesu																	sāmik	a masc	13	2	176		"Spot a mistake? <a class=""link"" href=""https://docs.google.com/forms/d/e/1FAIpQLSc0KxEDyN5G2Mqr4t3AvDpXxSOIbIBi0GrZsAGhDB207sjLow/viewform?usp=pp_url&entry.438735500=sāmika 2&entry.644913945=Anki Deck Vocab Beginner Pāli Course"">Fix it here</a>."
sāmika 1	p		masc		sāmī					owner					sāmī + ka	svāmika, svāmin					MN 54.2	potaliyasuttaṃ	tam’enaṃ jano disvā evaṃ vadeyya — ‘bhogī vata, bho, puriso, evaṃ kira bhogino bhogāni bhuñjantī’ti. tam’enaṃ <b>sāmikā</b> yattha yatth’eva passeyyuṃ tattha tatth’eva sāni hareyyuṃ.																	sāmik	a masc	13	2	176		"Spot a mistake? <a class=""link"" href=""https://docs.google.com/forms/d/e/1FAIpQLSc0KxEDyN5G2Mqr4t3AvDpXxSOIbIBi0GrZsAGhDB207sjLow/viewform?usp=pp_url&entry.438735500=sāmika 1&entry.644913945=Anki Deck Vocab Beginner Pāli Course"">Fix it here</a>."
salla 1	ps		masc							arrow; spike; dagger; dart; barb						śalya					SN 35.248	yavakalāpisuttaṃ	maññitaṃ, bhikkhave, rogo, maññitaṃ gaṇḍo, maññitaṃ <b>sallaṃ</b>. tasmā’t’iha, bhikkhave, ‘amaññamānena cetasā viharissāmā’ti — evañ’hi vo, bhikkhave, sikkhitabbaṃ.				SNP 22	uṭṭhānasuttaṃ<br/> cūḷavaggo 10	uṭṭhahatha nisīdatha, ko attho supitena vo, <br/>āturānañ’hi kā niddā, <b>salla</b>-viddhāna ruppataṃ.	Pakiṇṇaka-gāthā	Miscellaneous Verses	Verses							15n	sall	a masc	13	2	112	[sound:coming-soon.mp3]	"Spot a mistake? <a class=""link"" href=""https://docs.google.com/forms/d/e/1FAIpQLSc0KxEDyN5G2Mqr4t3AvDpXxSOIbIBi0GrZsAGhDB207sjLow/viewform?usp=pp_url&entry.438735500=salla 1&entry.644913945=Anki Deck Vocab Beginner Pāli Course"">Fix it here</a>."
sara 6	p		masc		sarati					stream; water-flow; tide; lit. flow			√sar 1 a (to go, flow)		√sar + a	saras	√sṛ		(SNa) kuto sarā nivattantī'ti ime saṃsārasarā kuto nivattanti, kiṃ āgamma nappavattantī'ti attho.		SN 1.27	sarasuttaṃ	kuto <b>sarā</b> nivattanti,<br/>kattha vaṭṭaṃ na vattati,<br/>kattha nāmañ'ca rūpañ'ca,<br/>asesaṃ uparujjhatī'ti.																	sar	a masc	13	2	118		"Spot a mistake? <a class=""link"" href=""https://docs.google.com/forms/d/e/1FAIpQLSc0KxEDyN5G2Mqr4t3AvDpXxSOIbIBi0GrZsAGhDB207sjLow/viewform?usp=pp_url&entry.438735500=sara 6&entry.644913945=Anki Deck Vocab Beginner Pāli Course"">Fix it here</a>."
sara 4	p		masc		sarati					memory			√sar 1 a (to remember)		√sar + a	smara	√smṛ				SN 35.96	parihānadhammasuttaṃ	idha, bhikkhave, bhikkhuno cakkhunā rūpaṃ disvā uppajjanti pāpakā akusalā <b>sara</b>-saṅkappā saṃyojaniyā.																	sar	a masc	13	2	118		"Spot a mistake? <a class=""link"" href=""https://docs.google.com/forms/d/e/1FAIpQLSc0KxEDyN5G2Mqr4t3AvDpXxSOIbIBi0GrZsAGhDB207sjLow/viewform?usp=pp_url&entry.438735500=sara 4&entry.644913945=Anki Deck Vocab Beginner Pāli Course"">Fix it here</a>."
sara 3	pp		masc		sarati					sound; voice; tone			√sar 1 a (to make sound)		√sar + a	svara	√svṛ				MN 139	araṇavibhaṅgasuttaṃ	tatra taramānassa bhāsato kāyo’pi kilamati, cittam’pi upahaññati,<b> saro</b>’pi upahaññati, kaṇṭho’pi āturīyati, avisaṭṭham’pi hoti aviññeyyaṃ taramānassa bhāsitaṃ.				AN 6.55	soṇasuttaṃ	taṃ kiṃ maññasi, soṇa, kusalo tvaṃ pubbe agāriyabhūto vīṇāya tanti-<b>ssare</b>'ti?											sar	a masc	13	2	118		"Spot a mistake? <a class=""link"" href=""https://docs.google.com/forms/d/e/1FAIpQLSc0KxEDyN5G2Mqr4t3AvDpXxSOIbIBi0GrZsAGhDB207sjLow/viewform?usp=pp_url&entry.438735500=sara 3&entry.644913945=Anki Deck Vocab Beginner Pāli Course"">Fix it here</a>."
sara 2	p		masc							arrow; lit. reed						śara					DHP 304	pakiṇṇakavaggo	dūre santo pakāsenti, himavanto'va pabbato,<br/>asant'ettha na dissanti, rattiṃ khittā yathā <b>sarā</b>.																	sar	a masc	13	2	118		"Spot a mistake? <a class=""link"" href=""https://docs.google.com/forms/d/e/1FAIpQLSc0KxEDyN5G2Mqr4t3AvDpXxSOIbIBi0GrZsAGhDB207sjLow/viewform?usp=pp_url&entry.438735500=sara 2&entry.644913945=Anki Deck Vocab Beginner Pāli Course"">Fix it here</a>."
sara 1	pp		masc							reed						śara					DN 26.9	cakkavattisuttaṃ	asīti-vassa-sahass’āyukesu, bhikkhave, manussesu ayaṃ jambudīpo avīci maññe phuṭo bhavissati manussehi, seyyathā’pi naḷavanaṃ vā <b>sara</b>-vanaṃ vā.				SN 35.247	chappāṇakopamasuttaṃ	tassa kusakaṇṭakā c'eva pāde vijjheyyuṃ, <b>sara</b>-pattāni ca gattāni vilekheyyuṃ.											sar	a masc	13	2	118		"Spot a mistake? <a class=""link"" href=""https://docs.google.com/forms/d/e/1FAIpQLSc0KxEDyN5G2Mqr4t3AvDpXxSOIbIBi0GrZsAGhDB207sjLow/viewform?usp=pp_url&entry.438735500=sara 1&entry.644913945=Anki Deck Vocab Beginner Pāli Course"">Fix it here</a>."
samaya 5	pp		masc							gathering; massing; congregation; lit. come together			√i 1 a (to come, go)		saṃ + √i > ay + *a	samaya	√i		(SNa) mahāsamayo'ti mahāsamūho.<br/>(SNt) samiti saṅgati sannipāto samayo, mahanto samayo mahāsamayo'ti		SN 1.37	samayasuttaṃ	mahāsamayo pavanasmiṃ,<br/>devakāyā samāgatā,<br/>āgat'amha imaṃ dhamma-<b>samayaṃ</b>,<br/>dakkhitāye aparājitasaṅghan'ti.				VIN PAT PC 32	gaṇabhojana sikkhāpada	gilānasamayo, cīvaradānasamayo, cīvarakārasamayo, addhānagamanasamayo, nāv’ābhiruhanasamayo, mahā-<b>samayo</b>, samaṇabhattasamayo.											samay	a masc	13	2	3913	[sound:samaya.mp3]	"Spot a mistake? <a class=""link"" href=""https://docs.google.com/forms/d/e/1FAIpQLSc0KxEDyN5G2Mqr4t3AvDpXxSOIbIBi0GrZsAGhDB207sjLow/viewform?usp=pp_url&entry.438735500=samaya 5&entry.644913945=Anki Deck Vocab Beginner Pāli Course"">Fix it here</a>."
samaya 3	p		masc		sameti					condition; state; lit. coming together			√i 1 a (to come, go)		saṃ + √i > ay + *a	samaya	√i				SNP 49	kalahavivādasuttaṃ<br/>aṭṭhakavaggo 11	ettāvat'aggam'pi vadanti h'eke, yakkhassa suddhiṃ idha paṇḍitāse,<br/>tesaṃ pan'eke <b>samayaṃ</b> vadanti, anupādisese kusalā vadānā.																	samay	a masc	13	2	3913	[sound:samaya.mp3]	"Spot a mistake? <a class=""link"" href=""https://docs.google.com/forms/d/e/1FAIpQLSc0KxEDyN5G2Mqr4t3AvDpXxSOIbIBi0GrZsAGhDB207sjLow/viewform?usp=pp_url&entry.438735500=samaya 3&entry.644913945=Anki Deck Vocab Beginner Pāli Course"">Fix it here</a>."
samaya 2	p		masc		sameti					right time; suitable occasion			√i 1 a (to come, go)		saṃ + √i > ay + *a	samaya	√i				VIN PAT NP 6	aññātakaviññatti sikkhāpada	yo pana bhikkhu aññātakaṃ gahapatiṃ vā gahapatāniṃ vā cīvaraṃ viññāpeyya, aññatra samayā, nissaggiyaṃ pācittiyaṃ. tatth’āyaṃ <b>samayo</b>: acchinnacīvaro vā hoti bhikkhu naṭṭha cīvaro vā. ayaṃ tattha <b>samayo</b>.																	samay	a masc	13	2	3913	[sound:samaya.mp3]	"Spot a mistake? <a class=""link"" href=""https://docs.google.com/forms/d/e/1FAIpQLSc0KxEDyN5G2Mqr4t3AvDpXxSOIbIBi0GrZsAGhDB207sjLow/viewform?usp=pp_url&entry.438735500=samaya 2&entry.644913945=Anki Deck Vocab Beginner Pāli Course"">Fix it here</a>."
samatha 3	p		masc		sammati				+gen	(vinaya) settlement (of); deciding (of); appeasement (of); adjudication (of)			√sam 3 ya (to be calm, tired)		√sam + a + tha<br/>sama + tha	śamatha	√śam				VIN PAT AS	adhikaraṇasamathā	ime kho pan'āyasmanto, satta adhikaraṇa-<b>samathā</b> dhammā uddesaṃ āgacchanti.																	samath	a masc	13	2	461	[sound:samatha.mp3]	"Spot a mistake? <a class=""link"" href=""https://docs.google.com/forms/d/e/1FAIpQLSc0KxEDyN5G2Mqr4t3AvDpXxSOIbIBi0GrZsAGhDB207sjLow/viewform?usp=pp_url&entry.438735500=samatha 3&entry.644913945=Anki Deck Vocab Beginner Pāli Course"">Fix it here</a>."
samaṇa 2	pp		masc							Ascetic; epithet of the Buddha			√sam 3 ya (to exert, strive)		√sam + aṇa	śramaṇa	√śram				TH 263	mahāmoggallāna-thera-gāthā	“evam’etaṃ mahāvīra, yathā <b>samaṇa</b> bhāsasi. <br/>ettha c’eke visīdanti, paṅkamh’iva jaraggavo.				MN 105	sunakkhattasuttaṃ	ṭhānaṃ kho pan'etaṃ, sunakkhatta, vijjati yaṃ idh'ekaccassa bhikkhuno evam'assa, taṇhā kho sallaṃ <b>samaṇena</b> vuttaṃ, avijjāvisadoso, chandarāgabyāpādena ruppati.											samaṇ	a masc	13	2	2218	[sound:samaṇa.mp3]	"Spot a mistake? <a class=""link"" href=""https://docs.google.com/forms/d/e/1FAIpQLSc0KxEDyN5G2Mqr4t3AvDpXxSOIbIBi0GrZsAGhDB207sjLow/viewform?usp=pp_url&entry.438735500=samaṇa 2&entry.644913945=Anki Deck Vocab Beginner Pāli Course"">Fix it here</a>."
sadda 3	p		masc							voice			√sadd 8 *e (to sound)		√sadd + a	śabda	√śabd				AN 7.50	methunasuttaṃ	api ca kho mātugāmassa <b>saddaṃ</b> suṇāti tirokuṭṭaṃ vā tiropākāraṃ vā hasantiyā vā bhaṇantiyā vā gāyantiyā vā rodantiyā vā																	sadd	a masc	13	2	488		"Spot a mistake? <a class=""link"" href=""https://docs.google.com/forms/d/e/1FAIpQLSc0KxEDyN5G2Mqr4t3AvDpXxSOIbIBi0GrZsAGhDB207sjLow/viewform?usp=pp_url&entry.438735500=sadda 3&entry.644913945=Anki Deck Vocab Beginner Pāli Course"">Fix it here</a>."
sadda 2	p		masc							word			√sadd 8 *e (to sound)		√sadd + a	śabda	√śabd				SN 5.10	vajirāsuttaṃ	yathā hi aṅga-sambhārā, hoti <b>saddo</b> ratho iti. <br/>evaṃ khandhesu santesu, hoti satto’ti sammuti																	sadd	a masc	13	2	488		"Spot a mistake? <a class=""link"" href=""https://docs.google.com/forms/d/e/1FAIpQLSc0KxEDyN5G2Mqr4t3AvDpXxSOIbIBi0GrZsAGhDB207sjLow/viewform?usp=pp_url&entry.438735500=sadda 2&entry.644913945=Anki Deck Vocab Beginner Pāli Course"">Fix it here</a>."
sadda 1	ps		masc							sound; noise			√sadd 8 *e (to sound)		√sadd + a	śabda	√śabd				VIN 1.0	verañjakaṇḍaṃ	taṃ kho pana bhavantaṃ gotamaṃ evaṃ kalyāṇo kitti-<b>saddo</b> abbhuggato				SN 35.28	ādittasuttaṃ	sotaṃ ādittaṃ, <b>saddā</b> ādittā, sotaviññāṇaṃ ādittaṃ, sotasamphasso āditto	Āditta-pariyāya-sutta	The Fire Sermon	Cardinal Suttas							39n	sadd	a masc	13	2	488	[sound:coming-soon.mp3]	"Spot a mistake? <a class=""link"" href=""https://docs.google.com/forms/d/e/1FAIpQLSc0KxEDyN5G2Mqr4t3AvDpXxSOIbIBi0GrZsAGhDB207sjLow/viewform?usp=pp_url&entry.438735500=sadda 1&entry.644913945=Anki Deck Vocab Beginner Pāli Course"">Fix it here</a>."
