moggallāna 1	p	7	masc		muggala					name of one of the Buddha's chief disciples; great disciple of the Buddha; foremost disciple in psychic power; lit. descendent of Muggala					muggala > moggala + *yāna	maudgalyāyana			(AN 1.190) etad'aggaṃ, bhikkhave, mama sāvakānaṃ bhikkhūnaṃ iddhimantānaṃ yad'idaṃ mahāmoggallāno<br/>(UDa) mahāmoggallāno'ti pūjāvacanaṃ. guṇavisesehi mahanto moggallāno'ti hi mahāmoggallāno														AN 7.61	pacalāyamānasuttaṃ	tato tvaṃ, <b>moggallāna</b>, uṭṭhāy'āsanā udakena akkhīni anumajjitvā disā anuvilokeyyāsi, nakkhattāni tārakarūpāni ullokeyyāsi					moggallān	a masc	13	2	298	[sound:moggallāna.mp3]	"Spot a mistake? <a class=""link"" href=""https://docs.google.com/forms/d/e/1FAIpQLSc0KxEDyN5G2Mqr4t3AvDpXxSOIbIBi0GrZsAGhDB207sjLow/viewform?usp=pp_url&entry.438735500=moggallāna 1&entry.644913945=Anki Deck Vocab Beginner Pāli Course"">Fix it here</a>."
accaya 2	pp	11	masc		acceti					fault; offence; transgression; lit. going beyond (the norm)			√i 1 a (to come, go)		ati + √i > ay + *a	atyaya	√i				MN 140	dhātuvibhaṅgasuttaṃ	<b>accayo</b> maṃ, bhante, accagamā yathābālaṃ yathāmūḷhaṃ yathāakusalaṃ, yo'haṃ bhagavantaṃ āvusovādena samudācaritabbaṃ amaññissaṃ.										SN 12.70	susimasuttaṃ	"tassa me, bhante, bhagavā <b>accayaṃ accayato</b> paṭiggaṇhātu, āyatiṃ saṁvarāyā""ti."					accay	a masc	13	2	373	[sound:accaya.mp3]	"Spot a mistake? <a class=""link"" href=""https://docs.google.com/forms/d/e/1FAIpQLSc0KxEDyN5G2Mqr4t3AvDpXxSOIbIBi0GrZsAGhDB207sjLow/viewform?usp=pp_url&entry.438735500=accaya 2&entry.644913945=Anki Deck Vocab Beginner Pāli Course"">Fix it here</a>."
saṃvara 2	pps	4	masc		saṃvarati				+instr or +gen	control (over); restraint (of); holding back (of)			√var 1 a (to cover, dress, restrain)		saṃ + √var + a	saṃvara	√vṛ				DHP 360	bhikkhuvaggo	cakkhunā <b>saṃvaro</b> sādhu, sādhu sotena <b>saṃvaro</b>,<br/>ghānena <b>saṃvaro</b> sādhu, sādhu jivhāya <b>saṃvaro</b>.				AN 10.61	avijjāsuttaṃ	tīṇi’p’āhaṃ sucaritāni sāhārāni vadāmi, no anāhārāni. ko c’āhāro tiṇṇaṃ sucaritānaṃ? ‘indriya-<b>saṃvaro</b>’ti’ssa vacanīyaṃ.				MN 107	gaṇakamoggallānasuttaṃ	tassa <b>saṁvarāya</b> paṭipajjāhi, rakkhāhi cakkhu’ndriyaṁ cakkhu’ndriye saṁvaraṁ āpajjāhi.	Anupubba-sikkhā	The Gradual Training	Teachings	18n	saṃvar	a masc	13	2	214	[sound:saṃvara.mp3]	"Spot a mistake? <a class=""link"" href=""https://docs.google.com/forms/d/e/1FAIpQLSc0KxEDyN5G2Mqr4t3AvDpXxSOIbIBi0GrZsAGhDB207sjLow/viewform?usp=pp_url&entry.438735500=saṃvara 2&entry.644913945=Anki Deck Vocab Beginner Pāli Course"">Fix it here</a>."
vāda 4	pp	13	masc		vadati					saying; speaking; mentioning			√vad 1 a (to speak, say)		√vad + *a	vāda	√vad				DHP 246	malavaggo	yo pāṇam’atipāteti, musā-<b>vādañ</b>’ca bhāsati. <br/>loke adinnam’ādiyati, paradārañ’ca gacchati. 										VIN PAT PC 73	mohana sikkhāpada	tañ’ce bhikkhuṃ aññe bhikkhū jāneyyuṃ: nisinnapubbaṃ iminā bhikkhunā dvattikkhattuṃ pātimokkhe uddissamāne, ko pana <b>vādo</b> bhiyyo'ti					vād	a masc	13	2	214	[sound:vāda.mp3]	"Spot a mistake? <a class=""link"" href=""https://docs.google.com/forms/d/e/1FAIpQLSc0KxEDyN5G2Mqr4t3AvDpXxSOIbIBi0GrZsAGhDB207sjLow/viewform?usp=pp_url&entry.438735500=vāda 4&entry.644913945=Anki Deck Vocab Beginner Pāli Course"">Fix it here</a>."
māsa 2	pp	4	masc							bean						māṣa					DN 22.5	mahāsatipaṭṭhānasuttaṃ	seyyathā’pi bhikkhave ubhatomukhā putoḷi pūrā nānāvihitassa dhaññassa seyyath’idaṃ sālīnaṃ vīhīnaṃ muggānaṃ <b>māsānaṃ</b> tilānaṃ taṇḍulānaṃ										DN 22.5	mahāsatipaṭṭhānasuttaṃ	tam’enaṃ cakkhumā puriso muñcitvā paccavekkheyya — ‘ime sālī, ime vīhī ime muggā ime <b>māsā</b> ime tilā ime taṇḍulā’ti.					mās	a masc	13	2	198	[sound:māsa.mp3]	"Spot a mistake? <a class=""link"" href=""https://docs.google.com/forms/d/e/1FAIpQLSc0KxEDyN5G2Mqr4t3AvDpXxSOIbIBi0GrZsAGhDB207sjLow/viewform?usp=pp_url&entry.438735500=māsa 2&entry.644913945=Anki Deck Vocab Beginner Pāli Course"">Fix it here</a>."
magga 1	pnp	9	masc							road; path; track			√magg 8 *e (to seek, search)		√magg + a	mārga	√mārg				DHP 123	pāpavaggo	vāṇijo'va bhayaṃ <b>maggaṃ</b>, appasattho mahaddhano,<br/>visaṃ jīvitu'kāmo'va, pāpāni parivajjaye.				SN 12.65	nagarasuttaṃ	seyyathā'pi, bhikkhave, puriso araññe pavane caramāno passeyya purāṇaṃ <b>maggaṃ</b> purāṇ'añjasaṃ pubbakehi manussehi anuyātaṃ.				MN 107	gaṇakamoggallānasuttaṃ	taṃ kiṃ maññasi, brāhmaṇa, idha puriso āgaccheyya rājagahaṃ gantu'kāmo. so taṃ upasaṅkamitvā evaṃ vadeyya, icchām'ahaṃ, bhante, rājagahaṃ gantuṃ, tassa me rājagahassa <b>maggaṃ </b>upadisā'ti.					magg	a masc	13	2	1356	[sound:magga.mp3]	"Spot a mistake? <a class=""link"" href=""https://docs.google.com/forms/d/e/1FAIpQLSc0KxEDyN5G2Mqr4t3AvDpXxSOIbIBi0GrZsAGhDB207sjLow/viewform?usp=pp_url&entry.438735500=magga 1&entry.644913945=Anki Deck Vocab Beginner Pāli Course"">Fix it here</a>."
sunakkhatta 2	pp	13	masc		nakkhatta					personal name of a former monk; lit. good star sign			√nakkh 1 a (to attain, arrive)		su + √nakkh + a + tta<br/>su + nakkha + tta	sunakṣatra	√nakṣ				MN 105	sunakkhattasuttaṃ	atha kho <b>sunakkhatto</b> licchaviputto yena bhagavā ten'upasaṅkami; upasaṅkamitvā bhagavantaṃ abhivādetvā ekam'antaṃ nisīdi.										MN 105	sunakkhattasuttaṃ	taṃ kiṃ maññasi, <b>sunakkhatta,</b> api nu tassa purisassa tasmiṃ vante puna bhottu'kamyatā assā'ti?					sunakkhatt	a masc	13	2	158		"Spot a mistake? <a class=""link"" href=""https://docs.google.com/forms/d/e/1FAIpQLSc0KxEDyN5G2Mqr4t3AvDpXxSOIbIBi0GrZsAGhDB207sjLow/viewform?usp=pp_url&entry.438735500=sunakkhatta 2&entry.644913945=Anki Deck Vocab Beginner Pāli Course"">Fix it here</a>."
putta 1	sss	3	masc							child; son						putra					SNP 8	mettasuttaṃ<br/>uragavaggo	mātā yathā niyaṃ <b>puttam</b> āyusā eka-puttam’anurakkhe, <br/>evam’pi sabba-bhūtesu, mānasaṃ bhāvaye aparimāṇaṃ.	Karaṇīya-metta-sutta	The Buddha’s Words on Loving-Kindness	Protective Recitations	SNP 16	maṅgalasuttaṃ<br/>cūḷavaggo 4	mātāpitu upaṭṭhānaṃ, <b>putta</b>-dārassa saṅgaho.<br/>anākulā ca kammantā, etaṃ maṅgalam’uttamaṃ. 	Maṅgala-sutta	The Highest Blessings	Protective Recitations	MN 27	cūḷahatthipadopamasuttaṃ	taṃ dhammaṃ suṇāti gahapati vā gahapati-<b>putto</b> vā aññatarasmiṃ vā kule paccājāto.	Anupubba-sikkhā	The Gradual Training	Teachings	51n	putt	a masc	13	2	716	[sound:putta.mp3]	"Spot a mistake? <a class=""link"" href=""https://docs.google.com/forms/d/e/1FAIpQLSc0KxEDyN5G2Mqr4t3AvDpXxSOIbIBi0GrZsAGhDB207sjLow/viewform?usp=pp_url&entry.438735500=putta 1&entry.644913945=Anki Deck Vocab Beginner Pāli Course"">Fix it here</a>."
bhoga 1	psp	7	masc		bhuñjati					wealth; possession; property			√bhuj 2 ṃa (to eat, enjoy)		√bhuj > bhog + a		√bhuj				MN 39	mahāassapurasuttaṃ	seyyathā’pi puriso bandhanāgāre baddho assa. so aparena samayena tamhā bandhanā mucceyya sotthinā abbhayena, na c’assa kiñci <b>bhogānaṃ</b> vayo.				VIBH 4.1.1	dukkhasaccaṃ	ñāti-byasanena vā phuṭṭhassa, <b>bhoga</b>-byasanena vā phuṭṭhassa, roga-byasanena vā phuṭṭhassa, sīla-byasanena vā phuṭṭhassa, diṭṭhi-byasanena vā phuṭṭhassa	Paṭicca-samuppāda	Dependent Origination	Teachings	MN 14	cūḷa dukkhakkhandhasuttaṃ	so tesaṃ bhogānaṃ ārakkh’ādhikaraṇaṃ dukkhaṃ domanassaṃ paṭisaṃvedeti, kin’ti me <b>bhoge</b> n’eva rājāno hareyyuṃ, na corā hareyyuṃ, na aggi daheyya, na udakaṃ vaheyya, na appiyā dāy'ādā hareyyun’ti				23n	bhog	a masc	13	2	474	[sound:bhoga.mp3]	"Spot a mistake? <a class=""link"" href=""https://docs.google.com/forms/d/e/1FAIpQLSc0KxEDyN5G2Mqr4t3AvDpXxSOIbIBi0GrZsAGhDB207sjLow/viewform?usp=pp_url&entry.438735500=bhoga 1&entry.644913945=Anki Deck Vocab Beginner Pāli Course"">Fix it here</a>."
upakkilesa	ss		masc		upakilissati					impurity; defilement; blemish; corruption			√kilis 3 ya (to be dirty, be molested)		upa + √kilis > kiles + *a	upakleśa	√kliś	upakilesa									MN 39	mahāassapurasuttaṃ	so ime pañca nīvaraṇe pahāya cetaso <b>upakkilese</b> paññāya dubbalīkaraṇe	Anupubba-sikkhā	The Gradual Training	Teachings	MN 39	mahāassapurasuttaṃ	so evaṃ samāhite citte parisuddhe pariyodāte anaṅgaṇe vigat’<b>ūpakkilese</b> mudubhūte kammaniye ṭhite āneñjappatte  pubbenivās'ānussatiñāṇāya cittaṃ abhininnāmeti.	Anupubba-sikkhā	The Gradual Training	Teachings	18n	upakkiles	a masc	13	2	269	[sound:coming-soon.mp3]	"Spot a mistake? <a class=""link"" href=""https://docs.google.com/forms/d/e/1FAIpQLSc0KxEDyN5G2Mqr4t3AvDpXxSOIbIBi0GrZsAGhDB207sjLow/viewform?usp=pp_url&entry.438735500=upakkilesa&entry.644913945=Anki Deck Vocab Beginner Pāli Course"">Fix it here</a>."
paccaya 2	psp	7	masc		pacceti					cause; reason; supporting condition; precondition; requirement			√i 1 a (to come, go)		pati + √i > ay + *a	pratyaya	√i				VIN PAT NP 29	sāsaṅka sikkhāpada	siyā ca tassa bhikkhuno koci'd'eva <b>paccayo</b> tena cīvarena vippavāsāya, chārattaparamaṃ tena bhikkhunā tena cīvarena vippavasitabbaṃ.				DSa	Nidānakathā	jhāna-<b>paccayo</b>, magga-<b>paccayo</b>, sampayutta-<b>paccayo</b>, vippayutta-<b>paccayo</b>, atthi-<b>paccayo</b>, n’atthi-<b>paccayo</b>, vigata-<b>paccayo</b>, avigata-<b>paccayo</b>.	Paṭṭhāna-mātikā-pāṭho		Funeral Chants	VIN PAT PC 49	senāvāsa sikkhāpada	siyā ca tassa bhikkhuno koci'd'eva <b>paccayo</b> senaṃ gamanāya, dirattatirattaṃ tena bhikkhunā senāya vasitabbaṃ. tato ce uttariṃ vaseyya, pācittiyaṃ.				65n	paccay	a masc	13	2	579	[sound:paccaya.mp3]	"Spot a mistake? <a class=""link"" href=""https://docs.google.com/forms/d/e/1FAIpQLSc0KxEDyN5G2Mqr4t3AvDpXxSOIbIBi0GrZsAGhDB207sjLow/viewform?usp=pp_url&entry.438735500=paccaya 2&entry.644913945=Anki Deck Vocab Beginner Pāli Course"">Fix it here</a>."
purisa 1	ssp	6	masc							man; person						puruṣa					SN 11.3	dhajaggasuttaṃ	arahaṃ sammāsambuddho vijjācaraṇasampanno sugato lokavidū anuttaro <b>purisa</b>-dammasārathi satthā devamanussānaṃ buddho bhagavā	Buddh’ābhitthuti	Homage to the Buddha	Homage to the Triple Gem	AN 5.57	abhiṇhapaccavekkhitabbaṭhānasuttaṃ	maraṇa-dhammo’mhi, maraṇaṃ anatītoti abhiṇhaṃ paccavekkhitabbaṃ itthiyā vā <b>purisena</b> vā gahaṭṭhena vā pabbajitena vā.	Pañca-abhiṇha-paccavekkhaṇā	Five Subjects for Frequent Recollection	Reflections	MN 152	indriyabhāvanāsuttaṃ	seyyathā'pi, ānanda, balavā <b>puriso</b> samiñjitaṃ vā bāhaṃ pasāreyya, pasāritaṃ vā bāhaṃ samiñjeyya.				02n	puris	a masc	13	2	2155	[sound:purisa.mp3]	"Spot a mistake? <a class=""link"" href=""https://docs.google.com/forms/d/e/1FAIpQLSc0KxEDyN5G2Mqr4t3AvDpXxSOIbIBi0GrZsAGhDB207sjLow/viewform?usp=pp_url&entry.438735500=purisa 1&entry.644913945=Anki Deck Vocab Beginner Pāli Course"">Fix it here</a>."
sāra 2	ppp	11	masc		sarati					core; essence; substance; value			√sar 1 a (to go, flow)		√sar + *a	sāra	√sṛ				SN 22.95	pheṇapiṇḍūpamasuttaṃ	kiñ’hi siyā, bhikkhave, pheṇa-piṇḍe <b>sāro</b>?				DHP 011	yamakavaggo	asāre sāramatino, <b>sāre</b> c'āsāradassino,<br/>te sāraṃ n'ādhigacchanti, micchāsaṅkappagocarā.				DHP 012	yamakavaggo	sārañ'ca sārato ñatvā, asārañ'ca asārato,<br/>te <b>sāraṃ </b>adhigacchanti, sammāsaṅkappa-gocarā.					sār	a masc	13	2	131	[sound:sāra.mp3]	"Spot a mistake? <a class=""link"" href=""https://docs.google.com/forms/d/e/1FAIpQLSc0KxEDyN5G2Mqr4t3AvDpXxSOIbIBi0GrZsAGhDB207sjLow/viewform?usp=pp_url&entry.438735500=sāra 2&entry.644913945=Anki Deck Vocab Beginner Pāli Course"">Fix it here</a>."
attha 01	ps	3	masc							meaning; significance			√ar 1 a (to move, attain)		√ar + tha	artha	√ṛ				SN 22.4	dutiyahāliddikānisuttaṃ	imassa nu kho, bhante, bhagavatā saṃkhittena bhāsitassa kathaṃ vitthārena <b>attho</b> daṭṭhabbo’ti?				MN 27	cūḷahatthipadopamasuttaṃ	so dhammaṃ deseti ādikalyāṇaṃ majjhekalyāṇaṃ pariyosānakalyāṇaṃ s’<b>ātthaṃ</b> sabyañjanaṃ, kevalaparipuṇṇaṃ parisuddhaṃ brahmacariyaṃ pakāseti.	Buddh'ābhitthuti	Homage to the Buddha	Homage to the Triple Gem	SN 22.1	nakulapitusuttaṃ	sādhu vat'āyasmantaṃ'y'eva sāriputtaṃ paṭibhātu etassa bhāsitassa <b>attho</b>'ti.				02n	atth	a masc	13	2	2769	[sound:attha.mp3]	"Spot a mistake? <a class=""link"" href=""https://docs.google.com/forms/d/e/1FAIpQLSc0KxEDyN5G2Mqr4t3AvDpXxSOIbIBi0GrZsAGhDB207sjLow/viewform?usp=pp_url&entry.438735500=attha 01&entry.644913945=Anki Deck Vocab Beginner Pāli Course"">Fix it here</a>."
sāriputta	pp	3	masc	matr, comp						name of one of the Buddha's chief disciples; great disciple of the Buddha; foremost disciple in great wisdom; lit. son of Sāri					sāri + putta	śāriputra			(MNa) sāriputto'ti ca pana manti sāriyā brāhmaṇiyā putto'ti ca pana evaṃ maṃ sabrahmacārī jānanti.<br/>(AN 1.189) etad'aggaṃ, bhikkhave, mama sāvakānaṃ bhikkhūnaṃ mahāpaññānaṃ yad'idaṃ sāriputto.		MN 24	rathavinītasuttaṃ	evaṃ vutte, āyasmā <b>sāriputto</b> āyasmantaṃ puṇṇaṃ mantāṇiputtaṃ etad'avoca, konāmo āyasmā, kathañ'ca pan'āyasmantaṃ sabrahmacārī jānantī'ti?				MN 43	mahāvedallasuttaṃ	sādh'āvuso'ti kho āyasmā mahākoṭṭhiko āyasmato sāriputtassa bhāsitaṃ abhinanditvā anumoditvā āyasmantaṃ <b>sāriputtaṃ</b> uttariṃ pañhaṃ apucchi.				SN 22.1	nakulapitusuttaṃ	sādhu vat'āyasmantaṃ'y'eva <b>sāriputtaṃ</b> paṭibhātu etassa bhāsitassa attho'ti.					sāriputt	a masc	13	2	1836	[sound:sāriputta.mp3]	"Spot a mistake? <a class=""link"" href=""https://docs.google.com/forms/d/e/1FAIpQLSc0KxEDyN5G2Mqr4t3AvDpXxSOIbIBi0GrZsAGhDB207sjLow/viewform?usp=pp_url&entry.438735500=sāriputta&entry.644913945=Anki Deck Vocab Beginner Pāli Course"">Fix it here</a>."
pañha	ppp	5	masc							question; enquiry			√pañh 1 a (to ask, question)		√pañh + a	praśna	√prach				AN 4.42	pañhabyākaraṇasuttaṃ	atthi bhikkhave <b>pañho</b> ek’aṃsa-byākaraṇīyo, atthi <b>pañho</b> vibhajja-byākaraṇīyo, atthi <b>pañho</b> paṭipucchā-byākaraṇīyo; atthi <b>pañho</b> ṭhapanīyo.				AN 3.68	kathāvatthusuttaṃ	sac’āyaṃ, bhikkhave, puggalo <b>pañhaṃ</b> puṭṭho samāno aññen’aññaṃ paṭicarati, bahiddhā kathaṃ apanāmeti, kopañ’ca dosañ’ca appaccayañ’ca pātukaroti, evaṃ sant’āyaṃ, bhikkhave, puggalo akaccho hoti.				MN 43	mahāvedallasuttaṃ	sādh'āvuso'ti kho āyasmā mahākoṭṭhiko āyasmato sāriputtassa bhāsitaṃ abhinanditvā anumoditvā āyasmantaṃ sāriputtaṃ uttariṃ <b>pañhaṃ</b> apucchi.					pañh	a masc	13	2	512	[sound:pañha.mp3]	"Spot a mistake? <a class=""link"" href=""https://docs.google.com/forms/d/e/1FAIpQLSc0KxEDyN5G2Mqr4t3AvDpXxSOIbIBi0GrZsAGhDB207sjLow/viewform?usp=pp_url&entry.438735500=pañha&entry.644913945=Anki Deck Vocab Beginner Pāli Course"">Fix it here</a>."
puthujjana	pnp	3	masc	comp						common man; ordinary man; normal person; man in the street; lit. individual person					puthu + jana	pṛthak + jana					MN 2.2	sabbāsavasuttaṃ	diṭṭhi-saṃyojana-saṃyutto, bhikkhave, assutavā <b>puthujjano</b> na parimuccati jātiyā jarāya maraṇena sokehi paridevehi dukkhehi domanassehi upāyāsehi				SNP 45	tissametteyyasuttaṃ<br/>aṭṭhakavaggo 7	eko pubbe caritvāna, methunaṃ yo nisevati, <br/>yānaṃ bhantaṃ va taṃ loke, hīnam’āhu <b>puthujjanaṃ</b>.				SN 35.248	yavakalāpisuttaṃ	sace so assutavā <b>puthujjano</b> āyatiṃ punabbhavāya ceteti, evañ’hi so moghapuriso suhatataro hoti					puthujjan	a masc	13	2	255	[sound:puthujjana.mp3]	"Spot a mistake? <a class=""link"" href=""https://docs.google.com/forms/d/e/1FAIpQLSc0KxEDyN5G2Mqr4t3AvDpXxSOIbIBi0GrZsAGhDB207sjLow/viewform?usp=pp_url&entry.438735500=puthujjana&entry.644913945=Anki Deck Vocab Beginner Pāli Course"">Fix it here</a>."
daṇḍa 1	sp	3	masc							stick; truncheon; nightstick; club						daṇḍa											MN 51	kandarakasuttaṃ	nihita-<b>daṇḍo</b> nihita-sattho, lajjī day’āpanno sabbapāṇabhūtahit’ānukampī viharati.	Anupubba-sikkhā	The Gradual Training	Teachings	DHP 130	daṇḍavaggo	sabbe tasanti <b>daṇḍassa</b>, sabbesaṃ jīvitaṃ piyaṃ,<br/>attānaṃ upamaṃ katvā, na haneyya na ghātaye.				18n	daṇḍ	a masc	13	2	127	[sound:coming-soon.mp3]	"Spot a mistake? <a class=""link"" href=""https://docs.google.com/forms/d/e/1FAIpQLSc0KxEDyN5G2Mqr4t3AvDpXxSOIbIBi0GrZsAGhDB207sjLow/viewform?usp=pp_url&entry.438735500=daṇḍa 1&entry.644913945=Anki Deck Vocab Beginner Pāli Course"">Fix it here</a>."
majjha 2	p	15	masc							middle						madhya																	SN 12.15	kaccānagottasuttaṃ	sabbaṃ atthī'ti kho, kaccāna, ayam'eko anto. sabbaṃ n'atthī'ti ayaṃ dutiyo anto. ete te, kaccāna, ubho ante anupagamma <b>majjhena</b> tathāgato dhammaṃ deseti					majjh	a masc	13	2	400	[sound:majjha.mp3]	"Spot a mistake? <a class=""link"" href=""https://docs.google.com/forms/d/e/1FAIpQLSc0KxEDyN5G2Mqr4t3AvDpXxSOIbIBi0GrZsAGhDB207sjLow/viewform?usp=pp_url&entry.438735500=majjha 2&entry.644913945=Anki Deck Vocab Beginner Pāli Course"">Fix it here</a>."
rasa 1	psp	3	masc							taste; flavour			√ras 1 a (to taste)		√ras + a	rasa	√ras				UD 45	uposathasuttaṃ	seyyathā’pi mahāsamuddo eka-<b>raso</b> loṇa-<b>raso</b>; <br/>evam’eva kho ayaṃ dhammavinayo ekaraso vimuttiraso.				SN 35.28	ādittasuttaṃ	jivhā ādittā, <b>rasā</b> ādittā, jivhāviññāṇaṃ ādittaṃ, jivhāsamphasso āditto	Āditta-pariyāya-sutta	The Fire Sermon	Cardinal Suttas	DHP 354	taṇhāvaggo	sabba-dānaṃ dhammadānaṃ jināti, sabba-<b>rasaṃ</b> dhamma-<b>raso</b> jināti,<br/>sabba-ratiṃ dhammarati jināti, taṇhakkhayo sabbadukkhaṃ jināti.				39n	ras	a masc	13	2	437	[sound:rasa.mp3]	"Spot a mistake? <a class=""link"" href=""https://docs.google.com/forms/d/e/1FAIpQLSc0KxEDyN5G2Mqr4t3AvDpXxSOIbIBi0GrZsAGhDB207sjLow/viewform?usp=pp_url&entry.438735500=rasa 1&entry.644913945=Anki Deck Vocab Beginner Pāli Course"">Fix it here</a>."
māṇava	sp	3	masc		manu					young man; young gentleman; young Brahman; man					manu + *a	māṇava											TH 251	raṭṭhapālattheragāthā	duma-pphalānī’va patanti <b>māṇavā</b>, daharā ca vuḍḍhā ca sarīra-bhedā. <br/>etam’pi disvā pabbajito’mhi rāja, apaṇṇakaṃ sāmaññam’eva seyyo.	Raṭṭhapāla-thera-gāthā	From the Elder Raṭṭhapāla	Verses	DN 19.7	mahāgovindasuttaṃ	rājā disampati bhavantaṃ jotipālaṃ <b>māṇavaṃ</b> āmantayati				12n	māṇav	a masc	13	2	571	[sound:māṇava.mp3]	"Spot a mistake? <a class=""link"" href=""https://docs.google.com/forms/d/e/1FAIpQLSc0KxEDyN5G2Mqr4t3AvDpXxSOIbIBi0GrZsAGhDB207sjLow/viewform?usp=pp_url&entry.438735500=māṇava&entry.644913945=Anki Deck Vocab Beginner Pāli Course"">Fix it here</a>."
yāma 1	s	8	masc		yamati					watch (of the night); 1/3 of a night; lit. restraint			√yam 1 a (to control, strive, end)		√yam + *a	yāmā	√yam																MN 107	gaṇakamoggallānasuttaṃ	rattiyā paṭhamaṃ <b>yāmaṃ</b> caṅkamena nisajjāya āvaraṇīyehi dhammehi cittaṃ parisodhehi	Anupubba-sikkhā	The Gradual Training	Teachings	18n	yām	a masc	13	2	136	[sound:yāma.mp3]	"Spot a mistake? <a class=""link"" href=""https://docs.google.com/forms/d/e/1FAIpQLSc0KxEDyN5G2Mqr4t3AvDpXxSOIbIBi0GrZsAGhDB207sjLow/viewform?usp=pp_url&entry.438735500=yāma 1&entry.644913945=Anki Deck Vocab Beginner Pāli Course"">Fix it here</a>."
ariya 3	ss		masc							noble one; virtuous man						ārya											DN 22.18	mahāsatipaṭṭhānasuttaṃ	idha bhikkhave <b>ariya</b>-sāvako micchā-ājīvaṃ pahāya sammāājīvena jīvitaṃ kappeti, ayaṃ vuccati bhikkhave sammāājīvo.	Ariy’aṭṭhaṅgika-magga	The Noble Eightfold Path	Teachings	DN 22.18	mahāsatipaṭṭhānasuttaṃ	pītiyā ca virāgā upekkhako ca viharati, sato ca sampajāno, sukhañ’ca kāyena paṭisaṃvedeti, yaṃ taṃ <b>ariyā</b> ācikkhanti — ‘upekkhako satimā sukhavihārī’ti tatiyaṃ jhānaṃ upasampajja viharati.	Ariy’aṭṭhaṅgika-magga	The Noble Eightfold Path	Teachings	21n	ariy	a masc	13	2	1351	[sound:ariya.mp3]	"Spot a mistake? <a class=""link"" href=""https://docs.google.com/forms/d/e/1FAIpQLSc0KxEDyN5G2Mqr4t3AvDpXxSOIbIBi0GrZsAGhDB207sjLow/viewform?usp=pp_url&entry.438735500=ariya 3&entry.644913945=Anki Deck Vocab Beginner Pāli Course"">Fix it here</a>."
bheda 2	ps	10	masc		bhindati					schism; break; split			√bhid 2 ṃa (to break, split)		√bhid > bhed + *a	bheda	√bhid				VIN PAT SA 10	saṅghabheda sikkhāpada	yo pana bhikkhu samaggassa saṅghassa <b>bhedāya</b> parakkameyya bhedanasaṃvattanikaṃ vā adhikaraṇaṃ samādāya paggayha tiṭṭheyya										MN 51	kandarakasuttaṃ	pisuṇaṃ vācaṃ pahāya pisuṇāya vācāya paṭivirato hoti, ito sutvā na amutra akkhātā imesaṃ <b>bhedāya</b>, amutra vā sutvā na imesaṃ akkhātā amūsaṃ <b>bhedāya</b>	Anupubba-sikkhā	The Gradual Training	Teachings	18n	bhed	a masc	13	2	1076	[sound:bheda.mp3]	"Spot a mistake? <a class=""link"" href=""https://docs.google.com/forms/d/e/1FAIpQLSc0KxEDyN5G2Mqr4t3AvDpXxSOIbIBi0GrZsAGhDB207sjLow/viewform?usp=pp_url&entry.438735500=bheda 2&entry.644913945=Anki Deck Vocab Beginner Pāli Course"">Fix it here</a>."
parikkhāra	ps	3	masc		parikkharoti					requisite; accessory			√kar 7 o (to do, make)		pari + √kar > khar + *a	pariṣkāra	√kṛ				VIN 5.12.2	dutiyabhāṇavāro	atha kho vesālikā vajjiputtakā bhikkhū taṃ sāmaṇakaṃ <b>parikkhāraṃ</b> ādāya nāvāya sahajātiṃ ujjaviṃsu;										MN 2.4	sabbāsavasuttaṃ	paṭisaṅkhā yoniso gilāna-paccaya-bhesajja-<b>parikkhāraṃ</b> paṭisevāmi yāva’d’eva uppannānaṃ veyyābādhikānaṃ vedanānaṃ paṭighātāya abyāpajjha-paramatāyā	Cattaro parikkhāra	The Four Requisites	Reflections	30n	parikkhār	a masc	13	2	104	[sound:parikkhāra.mp3]	"Spot a mistake? <a class=""link"" href=""https://docs.google.com/forms/d/e/1FAIpQLSc0KxEDyN5G2Mqr4t3AvDpXxSOIbIBi0GrZsAGhDB207sjLow/viewform?usp=pp_url&entry.438735500=parikkhāra&entry.644913945=Anki Deck Vocab Beginner Pāli Course"">Fix it here</a>."
patha 2	ss	3	masc	in comps						mode; way; course; means			√path 1 a (to go, move)		√path + a	pathin	√path										TH 257	pārāpariyattheragāthā	tato pāsādikaṃ āsi, gataṃ bhuttaṃ nisevitaṃ.<br/>siniddhā tela-dhārā’va, ahosi iriyā-<b>patho</b>. 	Pārāpariya-thera-gāthā	From the Elder Pārāpariya	Verses	MN 104	sāmagāmasuttaṃ	passatha no tumhe, ānanda, taṃ vacana-<b>pathaṃ</b> aṇuṃ vā thūlaṃ vā yaṃ tumhe n'ādhivāseyyāthā”ti?	Cha sāraṇīya-dhammā	Principles of Cor diality	Teachings	13n	path	a masc	13	2	254	[sound:patha.mp3]	"Spot a mistake? <a class=""link"" href=""https://docs.google.com/forms/d/e/1FAIpQLSc0KxEDyN5G2Mqr4t3AvDpXxSOIbIBi0GrZsAGhDB207sjLow/viewform?usp=pp_url&entry.438735500=patha 2&entry.644913945=Anki Deck Vocab Beginner Pāli Course"">Fix it here</a>."
ānanda 2	pp	3	masc		ānandati					personal name of the Buddha's attendant; great disciple of the Buddha; foremost disciple in great learning, remembrance, conduct, resoluteness and service; lit. happy			√nand 1 a (to delight, enjoy)		ā + √nand + a	ānanda	√nand		(AN1.219..) etad'aggaṃ, bhikkhave, mama sāvakānaṃ bhikkhūnaṃ bahussutānaṃ ... satimantānaṃ ... gatimantānaṃ ... dhitimantānaṃ ... upaṭṭhākānaṃ yad'idaṃ ānando		AN 10.60	girimānandasuttaṃ	‘etaṃ santaṃ etaṃ paṇītaṃ yad'idaṃ sabbasaṅkhārasamatho sabb’ūpadhippaṭinissaggo taṇhākkhayo nirodho nibbānan’ti. ayaṃ vuccat’<b>ānanda</b>, nirodhasaññā.										MN 104	sāmagāmasuttaṃ	passatha no tumhe, <b>ānanda</b>, taṃ vacanapathaṃ aṇuṃ vā thūlaṃ vā yaṃ tumhe n'ādhivāseyyāthā”ti?					ānand	a masc	13	2	3447	[sound:ānanda.mp3]	"Spot a mistake? <a class=""link"" href=""https://docs.google.com/forms/d/e/1FAIpQLSc0KxEDyN5G2Mqr4t3AvDpXxSOIbIBi0GrZsAGhDB207sjLow/viewform?usp=pp_url&entry.438735500=ānanda 2&entry.644913945=Anki Deck Vocab Beginner Pāli Course"">Fix it here</a>."
attha 02	ss	10	masc							benefit; profit; good; welfare; goal			√ar 1 a (to move, attain)		√ar + tha	artha	√ṛ										SNP 8	mettasuttaṃ<br/>uragavaggo 8	karaṇīyam’<b>attha</b>-kusalena, yaṃ taṃ santaṃ padaṃ abhisamecca:  <br/>sakko ujū ca suhujū ca, suvaco c’assa mudu, anatimānī.	Karaṇīya-metta-sutta	The Buddha’s Words on Loving-Kindness	Protective Recitations	SN 12.22	dutiyadasabalasuttaṃ	par’<b>atthaṃ</b> vā hi bhikkhave sampassamānena alam’eva appamādena sampādetuṃ	Dhamma-pahaṃsāna	Striving According to the Dhamma	Teachings	53n	atth	a masc	13	2	2769	[sound:attha.mp3]	"Spot a mistake? <a class=""link"" href=""https://docs.google.com/forms/d/e/1FAIpQLSc0KxEDyN5G2Mqr4t3AvDpXxSOIbIBi0GrZsAGhDB207sjLow/viewform?usp=pp_url&entry.438735500=attha 02&entry.644913945=Anki Deck Vocab Beginner Pāli Course"">Fix it here</a>."
